{
  "$schema": "./schema.json",
  "common": {
    "name": "Meteoalarm Kaart",
    "description": "Meteoalarm kaart waarschuwt u voor actuele weersomstandigheden.",
    "not_available": "Meteoalarm is niet beschikbaar"
  },
  "error": {
    "missing_entity": "Het specificeren van de entiteit is vereist!",
    "missing_integration": "Het specificeren van de entiteit is vereist!",
    "invalid_integration": "Deze integratie is niet geldig!"
  },
  "editor": {
    "entity": "Entiteit",
    "integration": "Integratie",
    "required": "Verplicht",
    "automatic": "Automatisch",
    "recommended": "Aanbevolen",
    "override_headline": "Koptekst overschrijven"
  },
  "events": {
    "no_warnings": "Geen waarschuwingen",
    "wind": "wind",
    "snow_ice": "sneeuw/ijzel/bevriezing",
    "thunderstorms": "onweer",
    "fog": "mist",
    "hight_temperature": "hitte",
    "low_temperature": "koude",
    "coastal_event": "kustbedreiging",
    "forest_fire": "bos- en heidebranden",
    "avalanches": "lawines",
    "rain": "regen",
    "flood": "hoogwater",
    "rain_flood": "wateroverlast"
  },
  "messages": {
    "yellow": "Waarschuwing geel {0}",
    "orange": "Waarschuwing oranje {0}",
    "red": "Waarschuwing rood {0}"
  }
}
